{
  "version": "draft.04",
  "source": {
    "target": "figma-brands",
    "compositions": [
      "default",
      "alt"
    ],
    "generator": "@vertekum/ext-export-figma",
    "notices": [],
    "fingerprint": "sha256:bc60e92891d6ca6cb25c0f621cc741a9a4f7654654b8b2725f5d9cb946b46d85"
  },
  "collections": [
    {
      "name": "base",
      "modes": [
        "default"
      ],
      "variables": [
        {
          "name": "color/text",
          "type": "COLOR",
          "valuesByMode": {
            "default": {
              "r": 1,
              "g": 0,
              "b": 0,
              "a": 1
            }
          },
          "source": {
            "$type": "color",
            "$value": "{color.accent}"
          },
          "scopes": [],
          "codeSyntax": {},
          "alias": {
            "default": "color/accent"
          },
          "sources": {
            "default": "core"
          }
        }
      ]
    },
    {
      "name": "color-mode",
      "modes": [
        "default/light",
        "default/dark",
        "alt/light",
        "alt/dark"
      ],
      "variables": [
        {
          "name": "color/accent",
          "type": "COLOR",
          "valuesByMode": {
            "default/light": {
              "r": 1,
              "g": 0,
              "b": 0,
              "a": 1
            },
            "default/dark": {
              "r": 0.073,
              "g": 0.2627,
              "b": 0.789,
              "a": 1
            },
            "alt/light": {
              "r": 0.3298,
              "g": 0.72,
              "b": 0.3585,
              "a": 1
            },
            "alt/dark": {
              "r": 0.073,
              "g": 0.2627,
              "b": 0.789,
              "a": 1
            }
          },
          "source": {
            "$type": "color",
            "$value": {
              "colorSpace": "oklch",
              "components": [
                0.628,
                0.258,
                29.234
              ],
              "alpha": 1,
              "hex": "#ff2200"
            }
          },
          "scopes": [],
          "codeSyntax": {},
          "sources": {
            "default/light": "core",
            "default/dark": "dark",
            "alt/light": "alt",
            "alt/dark": "dark"
          }
        }
      ],
      "modeSources": {
        "default/light": {
          "composition": "default",
          "context": "light"
        },
        "default/dark": {
          "composition": "default",
          "context": "dark"
        },
        "alt/light": {
          "composition": "alt",
          "context": "light"
        },
        "alt/dark": {
          "composition": "alt",
          "context": "dark"
        }
      }
    },
    {
      "name": "density",
      "modes": [
        "cozy",
        "compact"
      ],
      "variables": [
        {
          "name": "space/gap",
          "type": "FLOAT",
          "valuesByMode": {
            "cozy": 8,
            "compact": 4
          },
          "source": {
            "$type": "dimension",
            "$value": {
              "value": 0.5,
              "unit": "rem"
            }
          },
          "scopes": [],
          "codeSyntax": {},
          "sources": {
            "cozy": "core",
            "compact": "compact"
          }
        },
        {
          "name": "space/inset",
          "type": "FLOAT",
          "valuesByMode": {
            "cozy": 8,
            "compact": 4
          },
          "source": {
            "$type": "dimension",
            "$value": {
              "value": 8,
              "unit": "px"
            }
          },
          "scopes": [],
          "codeSyntax": {},
          "sources": {
            "cozy": "core",
            "compact": "compact"
          }
        }
      ]
    }
  ],
  "styles": [
    {
      "kind": "text",
      "name": "typography/body",
      "properties": [
        {
          "property": "font-family",
          "value": "Inter, sans-serif"
        },
        {
          "property": "font-size",
          "value": "16px"
        },
        {
          "property": "font-weight",
          "value": 400
        },
        {
          "property": "letter-spacing",
          "value": "0px"
        },
        {
          "property": "line-height",
          "value": 1.4
        }
      ],
      "source": {
        "$type": "typography",
        "$value": {
          "fontFamily": [
            "Inter",
            "sans-serif"
          ],
          "fontSize": {
            "value": 16,
            "unit": "px"
          },
          "fontWeight": 400,
          "letterSpacing": {
            "value": 0,
            "unit": "px"
          },
          "lineHeight": 1.4
        }
      }
    }
  ]
}
